{
 "record_id": "OK-1",
 "source_class": "UNVERIFIED",
 "discovery_route": "UNKNOWN",
 "operator_external": "unknown",
 "agent_runtime": "Claude Code (executor session for ATK-OPEN-ADOPTION-01), Linux x86_64, Python 3.11.15",
 "asset_id": "headroom-atk-log-compression-check",
 "code_sha": "304af885193245da7186cb6b9ab247ec2494bd86",
 "headroom_version": "0.37.0",
 "date_utc": "2026-09-22T19:13Z",
 "task": "offline trial on the synthetic log, plus JSON-lines negative control, misuse controls, no-key refusal and 44 unit tests",
 "input_md5": "0ad9194a489136baa931881b78374cf7",
 "commands": [
  "git archive 304af885 integrations/headroom-atk",
  "pip install \"headroom-ai[proxy]==0.37.0\"",
  "iso.sh python3 make_log.py > deploy.log",
  "iso.sh python3 local_check.py",
  "iso.sh python3 test_local_check.py"
 ],
 "exit_code": 0,
 "result": "SUCCESS",
 "success_criterion": "local_check.py exit 0 on the synthetic log with both needles present",
 "success": true,
 "human_help": "none",
 "duration_minutes": 6,
 "usage_cost": "0 (offline; no model call)",
 "blockers": [],
 "reuse_intent": "unknown",
 "public_scope": "public",
 "evidence_urls": [
  "adoption/ATK-OPEN-ADOPTION-01/evidence/internal-2026-09-22/run_output.txt"
 ],
 "recorded_by": "Claude executor, ATK-OPEN-ADOPTION-01 r1",
 "notes": "Run inside an empty environment in a network namespace with loopback only (iso.sh). This is the author's own test: it is neither an independent reviewer replay nor adoption. Install step used the network normally."
}